{
  "schema_version": "1.0",
  "app_id": "qq",
  "level": "a",
  "generated_at": "2026-01-15T08:30:00Z",
  "meta": {
    "converter_version": "0.1.0",
    "collected_at": "2026-01-15T08:30:00Z",
    "source_files": ["{APPDATA}\\Tencent\\QQ\\session-store.json"],
    "launch": {
      "app_id": "qq",
      "executable_hint": "fixture-qq.exe"
    }
  }
}
